record_type,axis,threshold,op_high,label_high,label_low,method_label,attitude_label,type_code,type_name,description
axis,method,13,>=,엘리트,벼락치기,,,,,
axis,attitude,13,>=,자기주도,수동,,,,,
type,,,,,,엘리트,자기주도,T1,철두철미 엘리트형(엘리트 자기주도형),전체 시험 범위 중 선생님이 강조하신 핵심 포인트와 본인이 자주 틀리는 부분 위주로 범위를 축소하여 집중 학습한다면 학습 효율이 더 올라갈 것입니다. 학습 시간을 줄여 집중력을 극대화하고 시간 낭비를 최소화하는 것도 추천합니다.
type,,,,,,엘리트,수동,T2,뭐든 잘 흡수하는 스폰지형(엘리트 수동형),"능동적 자기주도가 어렵다면 학교나 학원 등의 수업 환경을 활용하는 것이 효과적입니다. 수업 전에 오늘 배울 내용을 간단히 확인하고, 수업 시간에는 설명을 들으며 노트에 정리한 후 수업 직후에는 배운 내용을 복습하고 문제를 풀며 바로 적용하는 것을 추천합니다."
type,,,,,,벼락치기,자기주도,T3,스릴 추구형(벼락치기 자기주도형),"단기간에 최대 효율을 이끌어내기 위해 개념을 가볍게 읽으며 핵심어에는 밑줄을 긋고, 밑줄 그은 핵심어를 중심으로 빠른 속독을 반복함으로써 학습 부담을 줄이면서도 암기를 강화하는 것을 추천합니다."
type,,,,,,벼락치기,수동,T4,여유 만끽형(벼락치기 수동형),"시험 직전, 학원에서 받은 자료나 학교 프린트 등을 우선적으로 집중 학습하되, 눈으로 읽기만 하는 수동적 방법 대신에 내용을 직접 요약해보거나 문제를 풀어보는 등 능동적 공부법을 더해 이해도를 높이는 것을 추천합니다."
